Comment,Final_Category,Google_Confidence,Unsupervised_Score
"Love the map integration, but the location accuracy could be improved.",KMeans_9_DBSCAN_-1,0.0,0.6941383321751425
Saves all my travel docs.,KMeans_0_DBSCAN_-1,0.0,0.8823420751220705
"Update is buggy, constantly showing error messages during use.",KMeans_2_DBSCAN_-1,0.0,0.8512910752512216
The update looks nice but the functionality has taken a hit.,KMeans_2_DBSCAN_-1,0.0,0.7773128539730726
"The app fails to load past trips sometimes, which is annoying when I need old details.",KMeans_8_DBSCAN_2,0.0,0.818247008937028
"App performance improved significantly after the recent update, great job!",KMeans_2_DBSCAN_-1,0.0,0.8684617457451592
"The UI could be a bit more intuitive, but overall it's a solid app for frequent travelers.",/Internet & Telecom/Mobile & Wireless,0.6000000238418579,0.8412975008877182
"Loving the new update, everything feels faster and more reliable.",KMeans_2_DBSCAN_-1,0.0,0.8024891728896718
"The recent update made things worse, keeps freezing every time I use it.",KMeans_2_DBSCAN_-1,0.0,0.7652971246070359
Easy to plan trips.,KMeans_0_DBSCAN_0,0.0,0.9999999768887881
"The update really enhanced the user experience, it's much more intuitive now.",KMeans_8_DBSCAN_-1,0.0,0.8106549108497766
"The premium version is priced well, great value for frequent travelers.",KMeans_0_DBSCAN_-1,0.0,0.7155505103068066
The premium subscription unlocks so many useful features. I couldn 't imagine traveling without it now.,KMeans_6_DBSCAN_1,0.0,0.7935147101198532
"The app is a great travel companion, but I 'd like to see more integrations with other travel tools.",/Internet & Telecom/Mobile & Wireless/Mobile Apps & Add-Ons,0.7200000286102295,0.7474295550793372
Lags during flight search.,KMeans_7_DBSCAN_3,0.0,0.7176679353287735
Best travel tool.,KMeans_0_DBSCAN_-1,0.0,0.9375771169582021
Love sharing travel photos.,KMeans_8_DBSCAN_-1,0.0,1.0000000123718091
Excellent for organizing trips and keeping all my plans in one app.,KMeans_8_DBSCAN_2,0.0,0.7995571306298483
"I'm impressed with the hotel deals, but the flight prices are often higher than other sites.",KMeans_7_DBSCAN_3,0.0,0.7445206726537296
Needs more customization.,KMeans_5_DBSCAN_-1,0.0,0.8525170552808442
"Update solved the annoying issues, app is usable again, thank you!",KMeans_8_DBSCAN_2,0.0,0.8216510895824525
"Too many video ads, they waste my time.",KMeans_1_DBSCAN_-1,0.0,0.8453205987030404
Better than other apps.,KMeans_8_DBSCAN_2,0.0,1.000000033232958
Easy to split expenses.,KMeans_1_DBSCAN_-1,0.0,1.0000000162897444
"Ads are too frequent, makes the app frustrating.",KMeans_1_DBSCAN_-1,0.0,0.8526868767082266
I like the reminders for check-ins and flight changes. Very useful for busy schedules.,KMeans_7_DBSCAN_3,0.0,0.728516993352551
Useful but needs improvements.,KMeans_2_DBSCAN_-1,0.0,0.9999999819046769
Quick hotel bookings.,KMeans_7_DBSCAN_6,0.0,0.8938937298557977
I had trouble sharing my itinerary with my friends. It keeps failing every time.,KMeans_8_DBSCAN_-1,0.0,0.7226134333890203
"I love using this app, but the latest update seems to have made it slower.",KMeans_8_DBSCAN_2,0.0,0.9999999787670691
"App performance improved significantly after the update, but it still freezes occasionally.",KMeans_2_DBSCAN_-1,0.0,0.9134816343217084
"Great value, premium features enhance the app significantly.",KMeans_8_DBSCAN_2,0.0,0.8235673238319566
"Happy to pay for premium, the additional features are fantastic.",KMeans_1_DBSCAN_-1,0.0,0.7936711550825261
Struggles with payment step.,KMeans_1_DBSCAN_-1,0.0,0.7622559345039931
"Ads cover important parts of the screen, very annoying.",KMeans_1_DBSCAN_-1,0.0,0.8662007947663195
Issues with search button.,KMeans_9_DBSCAN_-1,0.0,0.7050087919787364
"The new design looks great after the update, very clean interface.",KMeans_2_DBSCAN_-1,0.0,0.7968350420398038
Keeps everything in one place.,KMeans_2_DBSCAN_-1,0.0,0.779011689822124
"Update brought more bugs, app crashes at random times now.",KMeans_2_DBSCAN_-1,0.0,0.789964516566905
"The new premium tools are helpful, but the subscription is a bit overpriced.",KMeans_1_DBSCAN_-1,0.0,0.7458168441875093
"The booking process is seamless, and I always find the best deals on hotels and flights.",KMeans_7_DBSCAN_6,0.0,0.7112473078920554
"Easy to use and keeps all my travel details in one place, but could be faster.",KMeans_0_DBSCAN_-1,0.0,0.8245283151129166
Sharing options are limited.,KMeans_8_DBSCAN_-1,0.0,0.8254485080742353
